{
  "componentId": "stone_reference",
  "componentType": "solid",
  "componentName": "stone_reference",
  "parentAssembly": "solitaire",
  "geometryRole": "stone_reference",
  "productionRole": "excluded_by_default",
  "previewRole": "visible",
  "sourceJDLPaths": ["stone.diameter", "stone.depth", "setting.basketHeight"],
  "derivedParameters": {
    "girdleRadiusMm": 3.25,
    "girdleZMm": 14.200000000000001,
    "crownHeightMm": 1.4,
    "pavilionHeightMm": 2.6,
    "tableRadiusMm": 1.8200000000000003,
    "isGemologicalReproduction": false
  },
  "geometry": { "representation": "kernel-native-not-serialized" },
  "boundingBox": {
    "xmin": -3.2500001, "xmax": 3.2500001,
    "ymin": -3.2500001, "ymax": 3.2500001,
    "zmin": 11.599999900000002, "zmax": 15.6000001
  },
  "volume": 58.22141924499569,
  "transform": null,
  "generationStatus": "SUCCEEDED",
  "warnings": [],
  "fallbackUsed": false,
  "inspectionResults": []
}
